<?xmlns version="1.0" encoding="UTF-8" ?>
<ciudades xmlns:xsi="http://www.w3.org/2001/XMLSchema-instance" xsi:noNamespaceSchemaLocation="ciudad.xsd">

<ciudad >Roma </ciudad>
    <fecha-de-nacimiento>1996-12-18 </fecha-de-nacimiento >
    <hora>18:29:45</hora>
    <nota>7.5 </nota >
    <apto>true </apto>
    <puertaCerrada>true</puertaCerrada>
    <puertaAbierta>false</puertaAbierta>
</ciudades>